Problem,Fault,Frating,Symptoms,Verification Tests,Verification Result,Vrating,Vpass,Verification Hint,Identification Tests,Identification Result,Irating,Ipass,Identification Hint,Rectification Actions,Rectification Result,Rrating,Rpass,Rectification Hint
Lack of cooling 7.,Magnetic clutch does not engage.,A,None,Performance test the A/C system.,No noticeable engagement noise from engine compartment and insufficient cold air from passenger compartment vents.,1,Yes,Have you verified the customer concern?,Inspect A/C compressor clutch.,Excessive clearance between clutch coil and face plate or clutch coil open circuit.,1,Yes,Is the clutch cycling? What can cause it not to?,Replace clutch coil or reset air gap.,"Correct, by replacing the clutch coil or resetting the air gap you have resolved this issue.",1,Yes,Is the system clutch operating?
,,,,Check cabin mechanical devices.,Mechanical devices operating normally.,2,No,,System high side and low side pressure check.,The compressor is not engaging.,2,No,,Recharge system as required. Check for refrigerant leaks and repair as necessary.,This action did not rectify the condition.,2,No,
,,,,Check the A/C electrical system switching devices.,Switching devices operating normally.,2,No,,Visual inspection of A/C system.,Components in good condition.,2,No,,"Replace belt and inspect pulleys, tensioners, and driven components. Repair/replace as necessary.",This action did not rectify the condition.,2,No,
,,,,Check condition of any airflow filter devices.,Sufficient air from passenger compartment vents.,2,No,,Check cabin mechanical flow control devices for operation.,Devices operating normally.,2,No,,Replace damaged/blocked component(s); evacuate system and recharge with the proper amount of refrigerant.,This action did not rectify the condition.,2,No,
,,,,Check the A/C pipe system components for mechanical security. ,No metallic or vibrational noise from engine compartment or bulkhead area.,2,No,,Check for adequate air flow from vents.,Sufficient air flowing  from passenger compartment vents.,2,No,,Replace faulty motor/cable/linkage.,This action did not rectify the condition.,2,No,
,,,,,,,,,Audible inspection of expansion valve.,Expansion valve operating normally.,2,No,,Replace A/C pressure switch/sensor.,This action did not rectify the condition.,2,No,
,,,,,,,,,Audible inspection of A/C pipes and hoses.,No abnormal noises. ,2,No,,Replace cabin air filter.,This action did not rectify the condition.,2,No,
,,,,,,,,,,,,,,Replace expansion (TX) valve.,This action did not rectify the condition.,2,No,
,,,,,,,,,,,,,,Replace or re route pipes and retainers.,This action did not rectify the condition.,2,No,
