Problem,Fault,Frating,Symptoms,Verification Tests,Verification Result,Vrating,Vpass,Verification Hint,Identification Tests,Identification Result,Irating,Ipass,Identification Hint,Rectification Actions,Rectification Result,Rrating,Rpass,Rectification Hint
Lack of cooling 6.,Cabin air filter dirty and plugged.,A,Lack of air flow into passenger compartment.,Performance test the A/C system.,Insufficient cold air from passenger compartment air vents. Air flow appears weak.,1,Yes,Have you verified the customer concern?,Check for adequate air flow from vents.,Lack of air flow noticed. Further inspection reveals a dirty cabin air filter.,1,Yes,What restricts air flow within the vents?,Replace cabin air filter.,"That's correct, the filter is blocked and was causing this issue.",1,Yes,Have you checked the filters?
,,,,Check cabin mechanical devices.,Mechanical devices operating normally.,2,No,,System high side and low side pressure check.,System high side and low side pressures within specifications.,2,No,,Recharge system as required. Check for refrigerant leaks and repair as necessary.,This action did not rectify the condition.,2,No,
,,,,Check the A/C electrical system switching devices.,Switching devices operating normally.,2,No,,Visual inspection of A/C system.,Components in good condition.,2,No,,"Replace belt and inspect pulleys, tensioners, and driven components. Repair/replace as necessary.",This action did not rectify the condition.,2,No,
,,,,Check the A/C compressor drive devices.,Compressor drive devices appear to be in good condition.,2,No,,Perform system flow and pressure check.,System flow and  pressures within specifications.,2,No,,Replace faulty motor/cable/linkage.,This action did not rectify the condition.,2,No,
,,,,Check the main A/C operating components.,No excessive noise coming from system while A/C is operating.,2,No,,Check cabin mechanical flow control devices for operation.,Devices operating normally.,2,No,,Replace AC pressure switch/sensor.,This action did not rectify the condition.,2,No,
,,,,Check the A/C pipe system components for mechanical security. ,No metallic or vibrational noise from engine compartment or bulkhead area.,2,No,,Check that A/C compressor clutch engages.,Compressor clutch components are in good condition.,2,No,,Replace clutch coil or reset air gap.,This action did not rectify the condition.,2,No,
,,,,,,,,,Perform visual inspection and listen to compressor with stethoscope.,No abnormal noises coming from compressor.,2,No,,"Flush A/C system, replace compressor, receiver/drier, and refrigerant.",This action did not rectify the condition.,2,No,
,,,,,,,,,Perform audible inspection of expansion valve.,Expansion valve operating normally.,2,No,,Replace expansion (TX) valve.,This action did not rectify the condition.,2,No,
,,,,,,,,,Audible inspection of A/C pipes and hoses.,No abnormal noises. ,2,No,,Replace or re route pipes and retainers.,This action did not rectify the condition.,2,No,
