Problem,Fault,Frating,Symptoms,Verification Tests,Verification Result,Vrating,Vpass,Verification Hint,Identification Tests,Identification Result,Irating,Ipass,Identification Hint,Rectification Actions,Rectification Result,Rrating,Rpass,Rectification Hint
"No upshift when driven in drive (Hydraulically controlled, non-electronic transmission).",Governor valve stuck closed.,A,Vehicle will not upshift in the D position. ,Test drive vehicle for vehicle performance and drivability.,No upshift in drive. ,1,Yes,How can you verify the customer concern?,Perform transmission pressure tests. ,Line pressure normal. Governor pressure does not rise with vehicle speed. Further inspection reveals a seized governor valve. ,1,Yes,What causes the transmission to upshift automatically?,Replace governor valve assembly.,Well done. You have identified the fault and corrected it. ,1,Yes,If the governor valve is seized what is the best course of action?
,,,,Test drive vehicle for operation under initial movement from a standstill and hill starts.,Vehicle  accelerates normally from initial standstill. ,2,No,,"Perform converter ""stall"" test.","Results of converter ""stall"" test are within specifications.",2,No,,Replace torque converter assembly.,This action did not rectify the issue.,2,No,
,,,,Test drive vehicle for operation under all driving conditions when cold.,Vehicle  operates the same whether warm or cold.,2,No,,Check fluid level and condition. ,Fluid level is within required specifications. Condition of fluid appears OK. ,2,No,,Replace pan gasket and refill with proper fluid. ,This action did not rectify the issue.,2,No,
,,,,Test drive vehicle to determine any unusual transmission noises. ,No unusual noises heard. ,2,No,,Check gear selector linkage for proper adjustment. ,Gear selector linkage appears to be adjusted properly. ,2,No,,Replace front pump assembly.,This action did not rectify the issue.,2,No,
,,,,Test drive vehicle for operation in reverse.,Vehicle  operates normally in reverse.,2,No,,Check transmission cooler system for restriction (flow test).,No restrictions found. ,2,No,,Rebuild/overhaul valve body assembly.,This action did not rectify the issue.,2,No,
,,,,Check fluid level and condition. ,Fluid level is within required specifications. Condition of fluid appears OK. ,2,No,,Apply air pressure to operate bands and clutches.,Bands and clutches apply normally with no excessive leakage.,2,No,,"Flush fluid and replace filter, if equipped.",This action did not rectify the issue.,2,No,
,,,,Check gear selector linkage for proper adjustment. ,Gear selector linkage appears to be adjusted properly. ,2,No,,Inspect condition of transmission mounts.,Transmission mounts appear OK.,2,No,,Replace bands and clutches.,This action did not rectify the issue.,2,No,
,,,,Inspect condition of transmission mounts.,Transmission mounts appear OK.,2,No,,"Drop pan, look for plugged filter and debris. ",Filter clean and no apparent debris found. ,2,No,,Reseal the transmission.,This action did not rectify the issue.,2,No,